[
  {"contract_version": 1, "session_id": "11111111-1111-4111-8111-111111111111", "generation": 1, "frame_id": 1, "dictionary_revision": 1, "image_width": 64, "image_height": 32, "content_type": "image/png", "image_length": 1},
  {"contract_version": 1, "session_id": "22222222-2222-4222-8222-222222222222", "generation": 4, "frame_id": 9, "dictionary_revision": 12, "image_width": 1920, "image_height": 1080, "content_type": "image/jpeg", "image_length": 4194304},
  {"contract_version": 1, "session_id": "33333333-3333-4333-8333-333333333333", "generation": 2, "frame_id": 1, "dictionary_revision": 7, "image_width": 1280, "image_height": 720, "content_type": "image/png", "image_length": 2048}
]
